<?xml version="1.0" encoding="UTF-8"?>
<!DOCTYPE module PUBLIC "-//Google Inc.//DTD Google Web Toolkit 2.0.1//EN" "http://google-web-toolkit.googlecode.com/svn/tags/2.0.1/distro-source/core/src/gwt-module.dtd">
<!--
  Copyright 2010 Google Inc.

  Licensed under the Apache License, Version 2.0 (the "License"); you may not
  use this file except in compliance with the License. You may obtain a copy of
  the License at

  http://www.apache.org/licenses/LICENSE-2.0

  Unless required by applicable law or agreed to in writing, software
  distributed under the License is distributed on an "AS IS" BASIS, WITHOUT
  WARRANTIES OR CONDITIONS OF ANY KIND, either express or implied. See the
  License for the specific language governing permissions and limitations under
  the License.
-->
<module rename-to="validationtck">
  <inherits name="com.google.gwt.user.User" />
  <inherits name="org.hibernate.jsr303.tck.Jsr303Tck" />
  <inherits name="org.hibernate.validator.HibernateValidator" />
  <source path="">
    <exclude name="super" />
  </source>
  <entry-point class="com.google.gwt.sample.validationtck.Tck" />
  <replace-with class="com.google.gwt.sample.validationtck.TckTestValidator">
    <when-type-is class="javax.validation.Validator"/>
  </replace-with>
</module>