<?xml version="1.0" encoding="UTF-8"?>
<!DOCTYPE module PUBLIC "-//Google Inc.//DTD Google Web Toolkit 0.0.999//EN" "http://google-web-toolkit.googlecode.com/svn/tags/0.0.999/distro-source/core/src/gwt-module.dtd">
<module rename-to='stocks'>
  <!-- Inherit the core Web Toolkit stuff.                        -->
  <inherits name='com.google.gwt.user.User'/>
  <inherits name='com.google.gwt.bikeshed.list.List'/>
  <inherits name='com.google.gwt.bikeshed.tree.Tree'/>

  <!-- Inherit the default GWT style sheet.  You can change       -->
  <!-- the theme of your GWT application by uncommenting          -->
  <!-- any one of the following lines.                            -->
  <inherits name='com.google.gwt.user.theme.standard.Standard'/>
  <!-- <inherits name='com.google.gwt.user.theme.chrome.Chrome'/> -->
  <!-- <inherits name='com.google.gwt.user.theme.dark.Dark'/>     -->

  <!-- Other module inherits                                      -->

  <!-- Specify the app entry point class.                         -->
  <entry-point class='com.google.gwt.bikeshed.sample.stocks.client.StockSample'/>

  <!-- Specify the paths for translatable code                    -->
  <source path='client'/>
  <source path='shared'/>

</module>
